{
  "experiment_id": "v0.1-first-wave-canary",
  "suite_id": "php-web-v0.1",
  "prompt_id": "review_v3",
  "case_ids": [
    "laravel-authz-001"
  ],
  "providers": [
    {
      "provider": "anthropic",
      "model": "claude-sonnet-5-5",
      "api_key_env": "ANTHROPIC_API_KEY",
      "output_constraint": "json_schema",
      "thinking_mode": "between_tools",
      "reasoning_effort": "low",
      "model_id_stability": "pinned"
    },
    {
      "provider": "openai",
      "model": "gpt-5.6-terra",
      "api_key_env": "OPENAI_API_KEY",
      "api_type": "responses",
      "output_constraint": "json_schema",
      "reasoning_effort": "none",
      "model_id_stability": "stable_alias"
    },
    {
      "provider": "gemini",
      "model": "gemini-3.8-flash",
      "api_key_env": "GEMINI_API_KEY",
      "output_constraint": "json_schema",
      "reasoning_effort": "low",
      "model_id_stability": "stable_alias"
    },
    {
      "provider": "deepseek",
      "model": "deepseek-flash",
      "api_key_env": "DEEPSEEK_API_KEY",
      "output_constraint": "json_object",
      "reasoning_effort": "none",
      "model_id_stability": "mutable_alias"
    },
    {
      "provider": "xai",
      "model": "grok-4.7",
      "api_key_env": "XAI_API_KEY",
      "output_constraint": "json_schema",
      "reasoning_effort": "low",
      "model_id_stability": "mutable_alias"
    }
  ],
  "repeat_count": 1,
  "timeout": 300,
  "max_output_tokens": 4096,
  "mode": "reviewed"
}
